{
  "schemaVersion": "0.3.1",
  "experimentId": "02-prefill-vs-decode",
  "prompt": "the cat sat on the mat",
  "promptTokens": [
    {
      "id": 13,
      "text": "the",
      "position": 0
    },
    {
      "id": 4,
      "text": "cat",
      "position": 1
    },
    {
      "id": 12,
      "text": "sat",
      "position": 2
    },
    {
      "id": 11,
      "text": "on",
      "position": 3
    },
    {
      "id": 13,
      "text": "the",
      "position": 4
    },
    {
      "id": 9,
      "text": "mat",
      "position": 5
    }
  ],
  "config": {
    "dModel": 16,
    "nHeads": 2,
    "nLayers": 1,
    "vocabSize": 15,
    "seed": 42,
    "device": "cpu",
    "maxPos": 256,
    "promptLength": 6,
    "decodeSteps": 1,
    "dHead": 8
  },
  "prefill": {
    "label": "Read what already exists.",
    "technicalName": "Prefill",
    "inputTokenCount": 6,
    "qRowsProjected": 6,
    "kRowsProjected": 6,
    "vRowsProjected": 6,
    "attentionScoreShapePerHead": [
      6,
      6
    ],
    "attentionScoreCellsPerHead": 36,
    "attentionScoreCellsCausal": 21,
    "attentionScoreCellsMasked": 15,
    "attentionScoreCellsTotal": 72,
    "shapes": {
      "X": [
        6,
        16
      ],
      "Q": [
        6,
        16
      ],
      "K": [
        6,
        16
      ],
      "V": [
        6,
        16
      ],
      "scoresPerHead": [
        6,
        6
      ],
      "scoresAllHeads": [
        2,
        6,
        6
      ]
    },
    "attentionMath": {
      "countsWhat": "attention multiplies per head, not whole-model FLOPs",
      "dHead": 8,
      "scoreMultiply": {
        "formula": "Q[P, d_h] x K^T[d_h, P] -> [P, P]",
        "macScale": "P^2 x d_h",
        "p": 6
      },
      "valueAggregate": {
        "formula": "softmax(scores)[P, P] x V[P, d_h]",
        "macScale": "P^2 x d_h"
      }
    },
    "pipeline": [
      {
        "id": "x",
        "label": "Everyone already here",
        "tensor": "X [P, D]"
      },
      {
        "id": "proj",
        "label": "Ask, label, contribute",
        "tensor": "Q, K, V [P, D]"
      },
      {
        "id": "scores",
        "label": "Every question meets every label",
        "tensor": "QK\u1d40 \u2192 [H, P, P]"
      },
      {
        "id": "mask",
        "label": "No peeking ahead",
        "tensor": "causal mask on the square"
      },
      {
        "id": "mix",
        "label": "Gather what we may see",
        "tensor": "weighted V"
      },
      {
        "id": "cache",
        "label": "Keep labels and contents",
        "tensor": "K/V shelf [P, D]"
      }
    ],
    "logicalKvBytesWritten": 768,
    "logicalKvBytesAvailable": 768,
    "elapsedMs": 28.5279,
    "generatedToken": {
      "id": 5,
      "text": "for",
      "position": 6
    },
    "tokens": [
      {
        "id": 13,
        "text": "the",
        "position": 0
      },
      {
        "id": 4,
        "text": "cat",
        "position": 1
      },
      {
        "id": 12,
        "text": "sat",
        "position": 2
      },
      {
        "id": 11,
        "text": "on",
        "position": 3
      },
      {
        "id": 13,
        "text": "the",
        "position": 4
      },
      {
        "id": 9,
        "text": "mat",
        "position": 5
      }
    ],
    "scoreTensorShape": [
      2,
      6,
      6
    ]
  },
  "decode": {
    "label": "Write one new piece.",
    "technicalName": "Decode",
    "inputTokenCount": 1,
    "newTokenPosition": 6,
    "qRowsProjected": 1,
    "kRowsProjected": 1,
    "vRowsProjected": 1,
    "attentionScoreShapePerHead": [
      1,
      7
    ],
    "attentionScoreCellsPerHead": 7,
    "attentionScoreCellsCausal": 7,
    "attentionScoreCellsMasked": 0,
    "attentionScoreCellsTotal": 14,
    "shapes": {
      "Q_new": [
        1,
        16
      ],
      "K_new": [
        1,
        16
      ],
      "V_new": [
        1,
        16
      ],
      "K_cache": [
        7,
        16
      ],
      "V_cache": [
        7,
        16
      ],
      "scoresPerHead": [
        1,
        7
      ],
      "scoresAllHeads": [
        2,
        1,
        7
      ]
    },
    "attentionMath": {
      "countsWhat": "attention multiplies per head, not whole-model FLOPs",
      "dHead": 8,
      "scoreMultiply": {
        "formula": "Q_new[1, d_h] x K_cache^T[d_h, T] -> [1, T]",
        "macScale": "T x d_h",
        "t": 7
      },
      "valueAggregate": {
        "formula": "softmax(scores)[1, T] x V[T, d_h]",
        "macScale": "T x d_h"
      }
    },
    "pipeline": [
      {
        "id": "x",
        "label": "Only the newest word",
        "tensor": "x_new [1, D]"
      },
      {
        "id": "proj",
        "label": "One question, one new label",
        "tensor": "q_new, k_new, v_new [1, D]"
      },
      {
        "id": "append",
        "label": "Add it to the shelf",
        "tensor": "K/V cache [T, D]"
      },
      {
        "id": "scores",
        "label": "One question, long history",
        "tensor": "q_new K\u1d40 \u2192 [H, 1, T]"
      },
      {
        "id": "mix",
        "label": "Gather from the shelf",
        "tensor": "weighted V"
      },
      {
        "id": "logits",
        "label": "Guess the next word",
        "tensor": "next-token logits"
      }
    ],
    "logicalKvBytesWritten": 128,
    "logicalKvBytesAvailable": 896,
    "elapsedMs": 1.7278,
    "generatedToken": {
      "id": 12,
      "text": "sat",
      "position": 7
    },
    "scoreTensorShape": [
      2,
      1,
      7
    ]
  },
  "equivalence": {
    "cachedMatchesFullRecompute": true,
    "maxAbsLogitDiff": 0.0,
    "tolerance": 1e-05
  },
  "measurementDisclaimer": "P\u00b2 versus ~P here counts attention-score *cells per head*, not total Transformer compute. Q/K/V projections, the output projection, and any later FFN are separate. attentionScoreCellsCausal is the lower triangle P(P+1)/2; implementations may still materialize or skip the future differently, so this is a conceptual grid count, not hardware work. logicalKvBytes is tokens \u00d7 d_model \u00d7 2 \u00d7 4. elapsedMs is a laptop timer on a 16-d toy. None of this proves a GPU bottleneck.",
  "scaling": [
    {
      "promptLength": 6,
      "prefill": {
        "inputTokenCount": 6,
        "qRowsProjected": 6,
        "kRowsProjected": 6,
        "vRowsProjected": 6,
        "attentionScoreShapePerHead": [
          6,
          6
        ],
        "attentionScoreCellsPerHead": 36,
        "attentionScoreCellsCausal": 21,
        "attentionScoreCellsMasked": 15,
        "attentionScoreCellsTotal": 72,
        "shapes": {
          "X": [
            6,
            16
          ],
          "Q": [
            6,
            16
          ],
          "K": [
            6,
            16
          ],
          "V": [
            6,
            16
          ],
          "scoresPerHead": [
            6,
            6
          ],
          "scoresAllHeads": [
            2,
            6,
            6
          ]
        },
        "attentionMath": {
          "countsWhat": "attention multiplies per head, not whole-model FLOPs",
          "dHead": 8,
          "scoreMultiply": {
            "formula": "Q[P, d_h] x K^T[d_h, P] -> [P, P]",
            "macScale": "P^2 x d_h",
            "p": 6
          },
          "valueAggregate": {
            "formula": "softmax(scores)[P, P] x V[P, d_h]",
            "macScale": "P^2 x d_h"
          }
        },
        "pipeline": [
          {
            "id": "x",
            "label": "Everyone already here",
            "tensor": "X [P, D]"
          },
          {
            "id": "proj",
            "label": "Ask, label, contribute",
            "tensor": "Q, K, V [P, D]"
          },
          {
            "id": "scores",
            "label": "Every question meets every label",
            "tensor": "QK\u1d40 \u2192 [H, P, P]"
          },
          {
            "id": "mask",
            "label": "No peeking ahead",
            "tensor": "causal mask on the square"
          },
          {
            "id": "mix",
            "label": "Gather what we may see",
            "tensor": "weighted V"
          },
          {
            "id": "cache",
            "label": "Keep labels and contents",
            "tensor": "K/V shelf [P, D]"
          }
        ],
        "scoreTensorShape": [
          2,
          6,
          6
        ],
        "logicalKvBytesWritten": 768,
        "logicalKvBytesAvailable": 768,
        "elapsedMs": 0.2842
      },
      "decode": {
        "inputTokenCount": 1,
        "qRowsProjected": 1,
        "kRowsProjected": 1,
        "vRowsProjected": 1,
        "attentionScoreShapePerHead": [
          1,
          7
        ],
        "attentionScoreCellsPerHead": 7,
        "attentionScoreCellsCausal": 7,
        "attentionScoreCellsMasked": 0,
        "attentionScoreCellsTotal": 14,
        "shapes": {
          "Q_new": [
            1,
            16
          ],
          "K_new": [
            1,
            16
          ],
          "V_new": [
            1,
            16
          ],
          "K_cache": [
            7,
            16
          ],
          "V_cache": [
            7,
            16
          ],
          "scoresPerHead": [
            1,
            7
          ],
          "scoresAllHeads": [
            2,
            1,
            7
          ]
        },
        "attentionMath": {
          "countsWhat": "attention multiplies per head, not whole-model FLOPs",
          "dHead": 8,
          "scoreMultiply": {
            "formula": "Q_new[1, d_h] x K_cache^T[d_h, T] -> [1, T]",
            "macScale": "T x d_h",
            "t": 7
          },
          "valueAggregate": {
            "formula": "softmax(scores)[1, T] x V[T, d_h]",
            "macScale": "T x d_h"
          }
        },
        "pipeline": [
          {
            "id": "x",
            "label": "Only the newest word",
            "tensor": "x_new [1, D]"